{
  "id": "3f2504e0-4f89-41d3-9a0c-0305e82c3301",
  "codigo_visita": "VT-2026-0142",
  "status": "concluida",
  "data_visita": "2026-08-06",
  "hora_inicio": "09:15",
  "hora_fim": "11:40",
  "cliente": {
    "razao_social": "Metalurgica Exemplo Industria Ltda",
    "nome_fantasia": "MetalEx",
    "cnpj": "12345678000199",
    "codigo_cliente_erp": "CLI-0087",
    "contatos": [
      { "id": "c0a1b2c3-1111-4a22-8b33-445566778901", "nome": "Joao Pereira", "email": "joao.pereira@metalex.com.br", "departamento": "SST", "telefone": "19999990000" },
      { "id": "c0a1b2c3-2222-4a22-8b33-445566778902", "nome": "Ana Lima", "departamento": "RH" }
    ]
  },
  "unidade": {
    "nome": "Planta Industrial - Santa Barbara d Oeste",
    "endereco": {
      "logradouro": "Rua das Industrias",
      "numero": "1200",
      "bairro": "Distrito Industrial",
      "municipio": "Santa Barbara d Oeste",
      "uf": "SP",
      "cep": "13450000"
    },
    "cnae_principal": "2599-3/99",
    "grau_risco": 3,
    "numero_trabalhadores": 84
  },
  "tecnico": {
    "id": "tec-042",
    "nome": "Maria Souza",
    "funcao": "Tecnica de Seguranca do Trabalho",
    "registro_profissional": "MTE-SP-000123"
  },
  "setores": [
    {
      "id": "a1b2c3d4-1111-4a22-8b33-445566778899",
      "nome": "Producao - Linha de Corte",
      "descricao": "Setor de corte e conformacao de chapas metalicas.",
      "funcoes": [
        { "id": "f1a2b3c4-1111-4a22-8b33-445566778911", "nome": "Operador de prensa", "quantidade": 5 },
        { "id": "f1a2b3c4-2222-4a22-8b33-445566778912", "nome": "Auxiliar de producao", "quantidade": 3 }
      ],
      "avaliacoes_risco": [
        {
          "id": "b2c3d4e5-2222-4a22-8b33-445566778800",
          "grupo": "fisico",
          "agente": "Ruido continuo",
          "fonte_geradora": "Guilhotina e prensas",
          "presente": true,
          "nivel_exposicao": "avaliar",
          "medidas_controle_existentes": ["epi"],
          "observacao": "Nivel de pressao sonora elevado; EPC ausente. Requer dosimetria.",
          "quantificacao": { "data": "2026-08-06", "hora": "10:15", "equipamento": "Dosimetro Marca X mod. Y" },
          "evidencias": [
            {
              "id": "c3d4e5f6-3333-4a22-8b33-445566778811",
              "arquivo_ref": "visitas/3f2504e0-4f89-41d3-9a0c-0305e82c3301/fotos/ruido-linha-corte.jpg",
              "legenda": "Prensas sem enclausuramento acustico",
              "capturada_em": "2026-08-06T09:32:00-03:00"
            }
          ]
        },
        {
          "id": "d4e5f6a7-4444-4a22-8b33-445566778822",
          "grupo": "acidente",
          "agente": "Maquina sem protecao",
          "fonte_geradora": "Guilhotina",
          "presente": true,
          "nivel_exposicao": "alto",
          "medidas_controle_existentes": ["nenhuma"],
          "observacao": "Zona de prensagem sem protecao fixa/movel."
        }
      ],
      "verificacoes_epi_epc": [
        {
          "id": "e5f6a7b8-5555-4a22-8b33-445566778833",
          "tipo": "epi",
          "descricao": "Protetor auricular tipo concha",
          "numero_ca": "CA-12345",
          "fornecido": true,
          "em_uso": false,
          "estado_conservacao": "regular",
          "conforme": "nao_conforme",
          "observacao": "Fornecido, porem sem uso efetivo pelos operadores."
        },
        {
          "id": "f6a7b8c9-6666-4a22-8b33-445566778844",
          "tipo": "epc",
          "descricao": "Enclausuramento acustico das prensas",
          "conforme": "nao_conforme",
          "observacao": "Nao instalado."
        }
      ]
    }
  ],
  "nao_conformidades": [
    {
      "id": "a7b8c9d0-7777-4a22-8b33-445566778855",
      "descricao": "Zona de prensagem da guilhotina sem protecao, com risco de amputacao.",
      "origem_ref": "d4e5f6a7-4444-4a22-8b33-445566778822",
      "gravidade": "critica",
      "norma_referencia": "NR-12",
      "recomendacao": "Instalar protecao fixa/movel intertravada na zona de prensagem antes de retomar a operacao.",
      "prazo_sugerido_dias": 15,
      "evidencias": [
        {
          "id": "b8c9d0e1-8888-4a22-8b33-445566778866",
          "arquivo_ref": "visitas/3f2504e0-4f89-41d3-9a0c-0305e82c3301/fotos/guilhotina-sem-protecao.jpg",
          "legenda": "Zona de prensagem exposta",
          "capturada_em": "2026-08-06T09:48:00-03:00",
          "geolocalizacao": { "lat": -22.7539, "lng": -47.4141 }
        }
      ]
    }
  ],
  "assinaturas": [
    {
      "id": "c9d0e1f2-9999-4a22-8b33-445566778877",
      "papel": "tecnico",
      "nome": "Maria Souza",
      "cargo": "Tecnica de Seguranca do Trabalho",
      "assinatura_ref": "visitas/3f2504e0-4f89-41d3-9a0c-0305e82c3301/assinaturas/tecnico.png",
      "assinado_em": "2026-08-06T11:38:00-03:00"
    },
    {
      "id": "d0e1f2a3-aaaa-4a22-8b33-445566778888",
      "papel": "responsavel_empresa",
      "nome": "Joao Pereira",
      "cargo": "Coordenador de SST",
      "assinatura_ref": "visitas/3f2504e0-4f89-41d3-9a0c-0305e82c3301/assinaturas/responsavel.png",
      "assinado_em": "2026-08-06T11:40:00-03:00"
    }
  ],
  "observacoes_gerais": "Prioridade para a nao-conformidade critica da guilhotina (NR-12).",
  "auditoria": {
    "criado_em": "2026-08-06T09:15:00-03:00",
    "atualizado_em": "2026-08-06T11:40:00-03:00",
    "sincronizado_em": null,
    "dispositivo_id": "tablet-tecnico-07",
    "versao_app": "1.0.0",
    "versao_schema": "1.5.0"
  }
}
